Question,Answer
Venus Williams has had an amazing career despite her health issues.,Venus Williams' ability to compete at the highest level despite her health issues is remarkable.
Simona Halep's resilience is admirable.,Simona Halep's resilience and her ability to bounce back from setbacks are indeed admirable.
Pete Sampras was the best serve-and-volley player.,"Pete Sampras' serve-and-volley game was exceptional, making him a dominant force in the 90s."
Steffi Graf's Golden Slam in 1988 was historic.,Steffi Graf's Golden Slam in 1988 is one of the most impressive achievements in tennis history.
Martina Navratilova's longevity in tennis is inspiring.,"Martina Navratilova's career longevity, winning titles into her late 40s, is truly inspiring."
Roger Federer's elegance on the court is unmatched.,Roger Federer's elegance and effortless playing style have made him a fan favorite worldwide.
Serena Williams' power game revolutionized women's tennis.,"Serena Williams' power game has indeed revolutionized women's tennis, inspiring many young players."
Rafael Nadal's mental toughness is extraordinary.,"Rafael Nadal's mental toughness, especially in high-pressure situations, is extraordinary."
Novak Djokovic's return of serve is the best in the game.,Novak Djokovic's return of serve is considered one of the best in the history of tennis.
Andy Murray's defensive skills are top-notch.,Andy Murray's defensive skills and ability to retrieve difficult shots are top-notch.
Maria Sharapova's fighting spirit was incredible.,"Maria Sharapova's fighting spirit, especially in tough matches, was a hallmark of her career."
Venus Williams paved the way for future generations of players.,"Venus Williams' impact on future generations, particularly in advocating for equal prize money, is significant."
Simona Halep's court coverage is exceptional.,Simona Halep's exceptional court coverage and agility are key aspects of her game.
Pete Sampras dominated the 90s era of tennis.,"Pete Sampras dominated the 90s, especially at Wimbledon, where he won seven titles."
Steffi Graf's forehand was one of the best in history.,"Steffi Graf's forehand was a formidable weapon, contributing to her 22 Grand Slam titles."
Martina Navratilova's serve-and-volley game was exceptional.,Martina Navratilova's serve-and-volley game was ahead of its time and highly effective.
Roger Federer's versatility makes him a complete player.,"Roger Federer's versatility, excelling on all surfaces, makes him one of the most complete players ever."
Serena Williams' Grand Slam record is astonishing.,Serena Williams' record of 23 Grand Slam titles is a testament to her dominance in women's tennis.
Rafael Nadal's passion for the game is contagious.,Rafael Nadal's passion and intensity on the court are indeed contagious and inspiring.
Novak Djokovic's fitness level is extraordinary.,Novak Djokovic's extraordinary fitness level has been a significant factor in his success.
Andy Murray's tactical intelligence is underrated.,"Andy Murray's tactical intelligence, particularly in constructing points, is often underrated."
Maria Sharapova's marketability was unmatched.,Maria Sharapova's marketability and appeal off the court were unmatched during her career.
Venus Williams' longevity in the sport is commendable.,"Venus Williams' longevity, maintaining a high level of play for over two decades, is commendable."
Simona Halep's determination is inspiring.,"Simona Halep's determination and perseverance, especially after tough losses, are inspiring."
Pete Sampras' dominance at Wimbledon was unparalleled.,"Pete Sampras' dominance at Wimbledon, winning seven titles, remains one of his most significant achievements."
Steffi Graf's speed and agility were remarkable.,Steffi Graf's speed and agility were key components of her dominant play in the late 80s and 90s.
Martina Navratilova's dedication to fitness was ahead of her time.,Martina Navratilova's dedication to fitness and conditioning was ahead of its time.
Roger Federer's sportsmanship is exemplary.,"Roger Federer's sportsmanship and conduct on the court are exemplary, earning him widespread respect."
Serena Williams' comeback after childbirth was inspiring.,"Serena Williams' comeback after childbirth, winning a Grand Slam, was incredibly inspiring."
Rafael Nadal's humility off the court is commendable.,Rafael Nadal's humility and respect for his opponents off the court are commendable.
Novak Djokovic's ability to handle pressure is impressive.,Novak Djokovic's ability to stay calm and focused under pressure is impressive.
Andy Murray's ability to return difficult shots is incredible.,Andy Murray's ability to return difficult shots and stay in rallies is incredible.
Maria Sharapova's rivalries added excitement to women's tennis.,Maria Sharapova's rivalries with other top players added excitement and drama to women's tennis.
Venus Williams' advocacy for equal prize money was impactful.,Venus Williams' advocacy for equal prize money has had a lasting impact on the sport.
Simona Halep's backhand is a weapon.,Simona Halep's backhand is a reliable weapon that often dictates her matches.
Pete Sampras' rivalry with Andre Agassi was legendary.,Pete Sampras' rivalry with Andre Agassi was one of the most thrilling in tennis history.
Steffi Graf's all-court game was brilliant.,"Steffi Graf's all-court game, with her ability to play well on any surface, was brilliant."
Martina Navratilova's transition to doubles was smooth.,"Martina Navratilova's transition to doubles, winning numerous titles, was smooth and successful."
Roger Federer's influence on the next generation is significant.,"Roger Federer's influence on the next generation of tennis players is significant, inspiring many."
Serena Williams' fashion statements on the court were iconic.,Serena Williams' bold fashion statements on the court were iconic and often set trends.
Rafael Nadal's sportsmanship is praiseworthy.,Rafael Nadal's sportsmanship and respect for the game are praiseworthy.
Novak Djokovic's diet and fitness regime set new standards.,Novak Djokovic's diet and fitness regime have set new standards for professional athletes.
Andy Murray's humor off the court is refreshing.,Andy Murray's humor and down-to-earth personality off the court are refreshing.
Maria Sharapova's endorsements were numerous.,Maria Sharapova's numerous endorsements and business ventures were impressive.
Venus Williams' influence on young players is substantial.,Venus Williams' role in mentoring younger players and advocating for equal prize money has had a substantial impact.
Simona Halep's focus during matches is intense.,Simona Halep's intense focus during matches is a key factor in her success.
Pete Sampras' precision serves were feared.,"Pete Sampras' precision serves, especially on grass courts, were indeed feared by many opponents."
Steffi Graf's rivalry with Monica Seles was intense.,Steffi Graf's rivalry with Monica Seles was one of the most intense and memorable in tennis history.
Martina Navratilova's coaching career is noteworthy.,"Martina Navratilova's coaching career, including her work with various players, is noteworthy."
Roger Federer's impact on tennis history is undeniable.,"Roger Federer's impact on tennis history, with his numerous records and graceful play, is undeniable."
Serena Williams' influence on women's sports is monumental.,"Serena Williams' influence on women's sports extends beyond tennis, inspiring countless young athletes."
Rafael Nadal's loyalty to his team is admirable.,"Rafael Nadal's loyalty to his team, including his longtime coach and family, is admirable."
Novak Djokovic's mental strength is a key to his success.,"Novak Djokovic's mental strength, especially in tough matches, has been a key to his success."
Andy Murray's Olympic gold medals are a testament to his skill.,Andy Murray's two Olympic gold medals highlight his exceptional skill and determination.
Maria Sharapova's autobiography was revealing.,Maria Sharapova's autobiography provided an insightful look into her career and personal life.
Venus Williams' elegance on the court is notable.,Venus Williams' elegance and poise on the court have made her a role model for many.
Simona Halep's underdog story is inspiring.,Simona Halep's rise from an underdog to a Grand Slam champion is truly inspiring.
Pete Sampras' record at the US Open was impressive.,Pete Sampras' record of five US Open titles is a testament to his dominance.
Steffi Graf's one-handed backhand was a rare skill.,Steffi Graf's one-handed backhand was a rare and effective skill in women's tennis.
Martina Navratilova's advocacy for LGBTQ+ rights is impactful.,Martina Navratilova's advocacy for LGBTQ+ rights has had a significant impact beyond tennis.
Roger Federer's rivalries with Nadal and Djokovic are legendary.,Roger Federer's rivalries with Nadal and Djokovic have produced some of the greatest matches in tennis history.
Serena Williams' serve is one of the best in history.,"Serena Williams' serve, both powerful and accurate, is considered one of the best ever."
Rafael Nadal's dedication to his foundation is commendable.,"Rafael Nadal's dedication to his foundation, which supports educational and sports projects, is commendable."
Novak Djokovic's family support system is strong.,Novak Djokovic's strong family support system has played a crucial role in his success.
Andy Murray's advocacy for women's tennis is admirable.,"Andy Murray's advocacy for women's tennis, including his support for equal prize money, is admirable."
Maria Sharapova's style on the court was distinctive.,"Maria Sharapova's distinctive style on the court, with her powerful strokes and presence, was unique."
Venus Williams' business ventures are successful.,"Venus Williams' successful business ventures, including her fashion line, are impressive."
Simona Halep's footwork is quick and precise.,Simona Halep's quick and precise footwork is a key aspect of her game.
Pete Sampras' composure under pressure was exceptional.,"Pete Sampras' composure under pressure, especially in Grand Slam finals, was exceptional."
Steffi Graf's dominance in the late 80s was remarkable.,"Steffi Graf's dominance in the late 80s, including her Golden Slam, was remarkable."
Martina Navratilova's career longevity is impressive.,"Martina Navratilova's career longevity, competing at a high level for over two decades, is impressive."
Roger Federer's forehand is a thing of beauty.,"Roger Federer's forehand, known for its precision and power, is indeed a thing of beauty."
Serena Williams' competitive spirit is unmatched.,Serena Williams' competitive spirit and drive to win are unmatched in women's tennis.
Rafael Nadal's work ethic is second to none.,"Rafael Nadal's work ethic, both on and off the court, is second to none."
Novak Djokovic's adaptability to different surfaces is impressive.,Novak Djokovic's ability to adapt to different surfaces and conditions is impressive.
Andy Murray's comeback from injury was inspiring.,"Andy Murray's comeback from injury, returning to competitive tennis, was inspiring."
Maria Sharapova's achievements are noteworthy.,"Maria Sharapova's achievements, including five Grand Slam titles, are noteworthy."
Venus Williams' participation in multiple Olympics is impressive.,"Venus Williams' participation in multiple Olympics, winning gold medals, is impressive."
Simona Halep's achievements are praiseworthy.,"Simona Halep's achievements, including her Grand Slam titles, are praiseworthy."
Pete Sampras' contribution to tennis is significant.,"Pete Sampras' contribution to tennis, particularly in the 90s, is significant."
Steffi Graf's career Grand Slam was historic.,"Steffi Graf's career Grand Slam, winning all four majors in a single year, was historic."
Martina Navratilova's versatility on the court was remarkable.,"Martina Navratilova's versatility, excelling in both singles and doubles, was remarkable."
Roger Federer's consistency is legendary.,"Roger Federer's consistency, maintaining a high level of play over many years, is legendary."
Serena Williams' influence extends beyond tennis.,"Serena Williams' influence extends beyond tennis, impacting sports and culture worldwide."
Rafael Nadal's resilience is inspiring.,"Rafael Nadal's resilience, coming back from injuries to win major titles, is inspiring."
Novak Djokovic's dominance in men's tennis is unparalleled.,"Novak Djokovic's dominance in men's tennis, especially in the 2010s, is unparalleled."
Andy Murray's impact on British tennis is profound.,"Andy Murray's impact on British tennis, including ending the long wait for a British Grand Slam champion, is profound."
Maria Sharapova's legacy will be remembered.,"Maria Sharapova's legacy, both on and off the court, will be remembered for years to come."
Venus Williams' impact on the sport is substantial.,"Venus Williams' impact on the sport, particularly in advocating for equal prize money, is substantial."
Simona Halep's fighting spirit is commendable.,"Simona Halep's fighting spirit, never giving up in tough matches, is commendable."
Pete Sampras' legacy lives on.,"Pete Sampras' legacy, including his 14 Grand Slam titles, lives on in tennis history."
Steffi Graf's influence on women's tennis is lasting.,"Steffi Graf's influence on women's tennis, inspiring future generations, is lasting."
Martina Navratilova's contribution to tennis is immense.,"Martina Navratilova's contribution to tennis, through her achievements and advocacy, is immense."
Roger Federer's matches are always thrilling.,"Roger Federer's matches, known for their excitement and high level of play, are always thrilling."
Serena Williams' presence on the court is intimidating.,"Serena Williams' presence on the court, with her power and intensity, is intimidating to her opponents."
Naomi Osaka's rise to fame is remarkable.,"Naomi Osaka's rise, winning multiple Grand Slam titles at a young age, is indeed remarkable."
Ashleigh Barty's decision to retire early was surprising.,"Ashleigh Barty's decision to retire early shocked the tennis world, but she left an impressive legacy."
Dominic Thiem's backhand is one of the best in tennis.,Dominic Thiem's one-handed backhand is considered one of the best and most beautiful in tennis.
Daniil Medvedev's unorthodox playing style is unique.,Daniil Medvedev's unique and unorthodox playing style sets him apart from other players.
Coco Gauff's potential is enormous.,"Coco Gauff's potential is enormous, and she has already shown great promise at a young age."
Bianca Andreescu's resilience is impressive.,"Bianca Andreescu's resilience, especially her comeback from injuries, is truly impressive."
Stan Wawrinka's backhand is a work of art.,Stan Wawrinka's one-handed backhand is indeed a work of art and one of the best in the game.
Alexander Zverev has a promising future.,Alexander Zverev has shown great potential and is expected to have a successful future in tennis.
Garbiñe Muguruza's power game is exciting to watch.,Garbiñe Muguruza's powerful groundstrokes and aggressive play make her matches exciting to watch.
Kei Nishikori's agility on the court is remarkable.,Kei Nishikori's agility and quickness on the court are key aspects of his game.
Victoria Azarenka's comeback has been inspiring.,"Victoria Azarenka's comeback, reaching Grand Slam finals again, has been an inspiration to many."
Andrey Rublev's forehand is explosive.,Andrey Rublev's explosive forehand is one of the most powerful shots in tennis.
David Ferrer's work ethic was second to none.,David Ferrer's incredible work ethic and determination were hallmarks of his career.
Angelique Kerber's defensive skills are exceptional.,Angelique Kerber's defensive skills and ability to counterpunch are exceptional.
Milos Raonic's serve is one of the fastest.,Milos Raonic's serve is one of the fastest and most effective in the game.
Elina Svitolina's consistency is admirable.,Elina Svitolina's consistency and solid baseline play make her a tough opponent.
John Isner's serve is nearly unreturnable.,"John Isner's serve is nearly unreturnable, making him a formidable opponent on any surface."
Sloane Stephens' athleticism is impressive.,Sloane Stephens' athleticism and movement on the court are impressive.
Nick Kyrgios' talent is undeniable.,"Nick Kyrgios' talent is undeniable, and his matches are always entertaining."
Petra Kvitová's comeback from injury was remarkable.,Petra Kvitová's comeback after her hand injury and winning titles again was remarkable.
Denis Shapovalov's shot-making is creative.,Denis Shapovalov's creative shot-making and aggressive play are exciting to watch.
Karen Khachanov's power game is thrilling.,Karen Khachanov's powerful game and big shots make him a thrilling player to watch.
Madison Keys' groundstrokes are powerful.,"Madison Keys' powerful groundstrokes, especially her forehand, are major weapons."
Diego Schwartzman's speed and agility are notable.,Diego Schwartzman's speed and agility allow him to cover the court exceptionally well.
Jelena Ostapenko's aggressive play is entertaining.,Jelena Ostapenko's aggressive and fearless play style makes her matches thrilling.
Pablo Carreño Busta's resilience is commendable.,Pablo Carreño Busta's resilience and ability to fight through tough matches are commendable.
Belinda Bencic's versatility is a strength.,Belinda Bencic's versatility and ability to adapt her game are strengths.
Grigor Dimitrov's one-handed backhand is beautiful.,Grigor Dimitrov's one-handed backhand is one of the most aesthetically pleasing shots in tennis.
Karolina Pliskova's serve is a major weapon.,Karolina Pliskova's serve is a major weapon and one of the best in the women's game.
David Goffin's court coverage is impressive.,David Goffin's court coverage and movement are key aspects of his game.
Kiki Bertens' clay-court skills are outstanding.,Kiki Bertens' clay-court skills make her a formidable opponent on that surface.
Gael Monfils' athleticism is extraordinary.,Gael Monfils' athleticism and ability to entertain the crowd are extraordinary.
Johanna Konta's mental toughness is key.,Johanna Konta's mental toughness and focus during matches are key to her success.
Matteo Berrettini's forehand is dominant.,Matteo Berrettini's dominant forehand is a significant weapon in his game.
Anastasia Pavlyuchenkova's persistence is admirable.,Anastasia Pavlyuchenkova's persistence and determination have led to her success.
Roberto Bautista Agut's consistency is impressive.,Roberto Bautista Agut's consistency and solid baseline play make him a tough opponent.
Daria Kasatkina's creativity on the court is unique.,Daria Kasatkina's creativity and variety of shots on the court make her a unique player.
Feliciano Lopez's longevity in tennis is notable.,"Feliciano Lopez's longevity in tennis, competing at a high level for many years, is notable."
Sofia Kenin's fighting spirit is inspiring.,Sofia Kenin's fighting spirit and determination are inspiring.
Fabio Fognini's shot-making is spectacular.,Fabio Fognini's spectacular shot-making and flair on the court make his matches exciting.
Victoria Azarenka's intensity is unmatched.,Victoria Azarenka's unmatched intensity and focus during matches are key to her success.
Kevin Anderson's serve is a huge asset.,Kevin Anderson's serve is a huge asset and a key part of his game.
Jennifer Brady's rise in the rankings is impressive.,"Jennifer Brady's rise in the rankings, reaching Grand Slam finals, is impressive."
Alex de Minaur's speed on the court is exceptional.,Alex de Minaur's exceptional speed and quickness on the court are key aspects of his game.
Camila Giorgi's aggressive play is thrilling.,Camila Giorgi's aggressive play and powerful groundstrokes make her matches thrilling.
Borna Coric's defensive skills are notable.,Borna Coric's notable defensive skills and ability to retrieve difficult shots are impressive.
Elise Mertens' versatility is a strength.,Elise Mertens' versatility and all-court game make her a tough opponent.
Francisco Cerundolo's potential is promising.,Francisco Cerundolo's promising potential and recent performances show great promise.
Marta Kostyuk's breakthrough is exciting.,Marta Kostyuk's breakthrough performances and potential make her an exciting player to watch.
Jannik Sinner's composure is impressive.,Jannik Sinner's composure and ability to stay calm under pressure are impressive.
Iga Swiatek's performance at the French Open was outstanding.,Iga Swiatek's dominant performance at the French Open showcased her incredible talent.
Hubert Hurkacz's serve is powerful.,Hubert Hurkacz's powerful serve is a significant advantage in his matches.
Ons Jabeur's creativity is refreshing.,Ons Jabeur's creativity and variety of shots make her a refreshing player to watch.
Casper Ruud's consistency on clay is remarkable.,Casper Ruud's consistency on clay courts has led to many successful results.
Amanda Anisimova's potential is immense.,Amanda Anisimova's immense potential is evident in her powerful groundstrokes and court sense.
Jan-Lennard Struff's power game is exciting.,Jan-Lennard Struff's exciting power game makes his matches thrilling to watch.
Marketa Vondrousova's skill set is impressive.,Marketa Vondrousova's impressive skill set and tactical play are key to her success.
Lorenzo Musetti's shot-making is creative.,Lorenzo Musetti's creative shot-making and flair on the court are enjoyable to watch.
Paula Badosa's resilience is notable.,Paula Badosa's resilience and ability to fight through tough matches are notable.
Tommy Paul's rise in the rankings is commendable.,Tommy Paul's rise in the rankings and consistent performances are commendable.
Ekaterina Alexandrova's aggressive play is thrilling.,Ekaterina Alexandrova's thrilling aggressive play makes her matches exciting.
Aslan Karatsev's breakthrough was spectacular.,Aslan Karatsev's spectacular breakthrough and deep runs in tournaments were impressive.
Marton Fucsovics' athleticism is extraordinary.,Marton Fucsovics' extraordinary athleticism and physical fitness are remarkable.
Jessica Pegula's consistency is key.,Jessica Pegula's key to success lies in her consistency and solid baseline game.
Ugo Humbert's left-handed game is unique.,Ugo Humbert's unique left-handed game presents challenges for his opponents.
Alison Riske's fighting spirit is inspiring.,Alison Riske's inspiring fighting spirit and determination are evident in her matches.
Reilly Opelka's serve is one of the best.,Reilly Opelka's powerful serve is one of the best and most difficult to return.
Caroline Garcia's power game is thrilling.,Caroline Garcia's thrilling power game and aggressive play are enjoyable to watch.
Daniel Evans' shot-making is creative.,Daniel Evans' creative shot-making and variety make his matches entertaining.
Marie Bouzkova's potential is promising.,Marie Bouzkova's promising potential and solid performances indicate a bright future.
Sam Querrey's serve is a major weapon.,Sam Querrey's serve is a major weapon and a key part of his game.
Ajla Tomljanovic's rise in the rankings is impressive.,Ajla Tomljanovic's impressive rise in the rankings reflects her hard work and skill.
Filip Krajinovic's consistency is notable.,Filip Krajinovic's notable consistency and steady play are strengths in his game.
Veronika Kudermetova's aggressive play is thrilling.,Veronika Kudermetova's thrilling aggressive play and powerful shots are exciting.
Taylor Fritz's forehand is powerful.,Taylor Fritz's powerful forehand is a significant weapon in his game.
Anett Kontaveit's mental toughness is key.,Anett Kontaveit's key to success is her mental toughness and focus during matches.
Lloyd Harris' serve is a huge asset.,Lloyd Harris' serve is a huge asset and a crucial part of his game.
Aljaž Bedene's defensive skills are impressive.,Aljaž Bedene's impressive defensive skills and ability to counterattack are notable.
Ann Li's potential is immense.,Ann Li's immense potential and solid performances indicate a bright future.
Marco Cecchinato's clay-court skills are outstanding.,Marco Cecchinato's outstanding clay-court skills make him a formidable opponent on that surface.
Bernarda Pera's rise in the rankings is commendable.,Bernarda Pera's commendable rise in the rankings reflects her hard work and determination.
Jordan Thompson's work ethic is inspiring.,Jordan Thompson's inspiring work ethic and relentless effort are key to his success.
Su-Wei Hsieh's shot-making is unique.,Su-Wei Hsieh's unique shot-making and unconventional style make her matches interesting.
Miomir Kecmanovic's potential is promising.,Miomir Kecmanovic's promising potential and solid performances indicate a bright future.
Aliaksandra Sasnovich's resilience is notable.,Aliaksandra Sasnovich's notable resilience and ability to fight through tough matches are impressive.
Alexander Bublik's creativity on the court is refreshing.,Alexander Bublik's refreshing creativity on the court and variety of shots are enjoyable to watch.
Sara Sorribes Tormo's consistency is key.,Sara Sorribes Tormo's key to success lies in her consistency and solid baseline game.
Yoshihito Nishioka's speed is exceptional.,Yoshihito Nishioka's exceptional speed and quickness on the court are key aspects of his game.
Kristina Mladenovic's doubles skills are outstanding.,Kristina Mladenovic's outstanding doubles skills and success in doubles matches are impressive.
Andreas Seppi's longevity in tennis is impressive.,"Andreas Seppi's impressive longevity in tennis, competing at a high level for many years, is notable."
Barbora Krejcikova's breakthrough was remarkable.,Barbora Krejcikova's remarkable breakthrough and success in singles and doubles are commendable.
Alejandro Davidovich Fokina's energy on the court is infectious.,Alejandro Davidovich Fokina's infectious energy on the court and enthusiastic play are enjoyable to watch.
